{
    "$schema": "https://json-schema.org/draft/2020-12/schema",
    "$defs": {
        "ArchitectureConstraint": {
            "type": "string",
            "description": "#ArchitectureConstraint is one basic token or two basic tokens separated by a\nslash. #ReleaseIndex additionally limits each token to 128 ASCII bytes.",
            "maxLength": 257,
            "minLength": 1,
            "pattern": "^[a-z0-9]+([._-][a-z0-9]+)*(/[a-z0-9]+([._-][a-z0-9]+)*)?$"
        },
        "BasicTokenConstraint": {
            "type": "string",
            "description": "#BasicTokenConstraint is a basic token: 1 to 128 ASCII bytes that match\n^[a-z0-9]+([._-][a-z0-9]+)*$.",
            "maxLength": 128,
            "minLength": 1,
            "pattern": "^[a-z0-9]+([._-][a-z0-9]+)*$"
        },
        "ContentSizeConstraint": {
            "type": "string",
            "description": "#ContentSizeConstraint is a string matching ^(0|[1-9][0-9]*)$.\n#ReleaseIndex additionally caps its numeric value at 9223372036854775807.",
            "maxLength": 19,
            "minLength": 1,
            "pattern": "^(0|[1-9][0-9]*)$"
        },
        "FileEntryAnnotationsShape": {
            "type": "object",
            "description": "#FileEntryAnnotationsShape defines file-entry annotation constraints used by\nthe JSON Schema projection. The generator may omit constraints it cannot\nrepresent.",
            "additionalProperties": true,
            "properties": {
                "io.imgoci.architecture": {
                    "description": "io.imgoci.architecture is the architecture selector.",
                    "$ref": "#/$defs/ArchitectureConstraint"
                },
                "io.imgoci.compression": {
                    "description": "io.imgoci.compression is the decoder applied to the stored file.",
                    "$ref": "#/$defs/BasicTokenConstraint"
                },
                "io.imgoci.content.digest": {
                    "description": "io.imgoci.content.digest is the SHA-256 digest of the decoded content.",
                    "$ref": "#/$defs/SHA256DigestConstraint"
                },
                "io.imgoci.content.size": {
                    "description": "io.imgoci.content.size is the byte length of the decoded content, encoded as\na string matching ^(0|[1-9][0-9]*)$.",
                    "$ref": "#/$defs/ContentSizeConstraint"
                },
                "io.imgoci.filename": {
                    "description": "io.imgoci.filename is the producer-chosen filename for the decoded content.",
                    "$ref": "#/$defs/FilenameConstraint"
                },
                "io.imgoci.representation": {
                    "description": "io.imgoci.representation is the deliverable representation selector.",
                    "$ref": "#/$defs/BasicTokenConstraint"
                },
                "io.imgoci.role": {
                    "description": "io.imgoci.role is the file role.",
                    "$ref": "#/$defs/BasicTokenConstraint"
                },
                "io.imgoci.target": {
                    "description": "io.imgoci.target is the target selector.",
                    "$ref": "#/$defs/BasicTokenConstraint"
                },
                "io.imgoci.usage": {
                    "description": "io.imgoci.usage optionally serializes a deliverable usage set. This\nprojection checks non-empty comma-separated token syntax and the 4096-byte\nlimit; it does not check canonical order, uniqueness, or the\ninstall-offline dependency on install.",
                    "$ref": "#/$defs/UsageConstraint"
                }
            },
            "required": [
                "io.imgoci.architecture",
                "io.imgoci.compression",
                "io.imgoci.content.digest",
                "io.imgoci.content.size",
                "io.imgoci.filename",
                "io.imgoci.representation",
                "io.imgoci.role",
                "io.imgoci.target"
            ]
        },
        "FileEntryDescriptorShape": {
            "type": "object",
            "description": "#FileEntryDescriptorShape defines the file-entry descriptor and local\nfield constraints used by the JSON Schema projection.",
            "additionalProperties": true,
            "properties": {
                "annotations": {
                    "description": "annotations describes the file entry and its decoded content.",
                    "$ref": "#/$defs/FileEntryAnnotationsShape"
                },
                "artifactType": {
                    "description": "artifactType identifies the referenced file manifest's artifact type.",
                    "$ref": "#/$defs/MediaTypeConstraint"
                },
                "digest": {
                    "description": "digest is the SHA-256 digest of the referenced file manifest.",
                    "$ref": "#/$defs/SHA256DigestConstraint"
                },
                "mediaType": {
                    "description": "mediaType identifies the referenced object as an OCI image manifest.",
                    "$ref": "#/$defs/ImageManifestMediaTypeConstraint"
                },
                "size": {
                    "description": "size is the byte length of the referenced file manifest, not the file content.",
                    "$ref": "#/$defs/ManifestSizeConstraint"
                }
            },
            "required": [
                "annotations",
                "artifactType",
                "digest",
                "mediaType",
                "size"
            ]
        },
        "FilenameConstraint": {
            "type": "string",
            "description": "#FilenameConstraint is one path component containing 1 to 255 ASCII bytes\nthat match ^[a-z0-9]([a-z0-9._+-]{0,253}[a-z0-9])?$.",
            "maxLength": 255,
            "minLength": 1,
            "pattern": "^[a-z0-9]([a-z0-9._+-]{0,253}[a-z0-9])?$"
        },
        "ImageManifestMediaTypeConstraint": {
            "type": "string",
            "description": "#ImageManifestMediaTypeConstraint identifies an OCI image manifest without\nregard to ASCII letter case using a pattern that is portable to JSON Schema.",
            "pattern": "^[aA][pP][pP][lL][iI][cC][aA][tT][iI][oO][nN]/[vV][nN][dD]\\.[oO][cC][iI]\\.[iI][mM][aA][gG][eE]\\.[mM][aA][nN][iI][fF][eE][sS][tT]\\.[vV]1\\+[jJ][sS][oO][nN]$"
        },
        "IndexAnnotationsShape": {
            "type": "object",
            "description": "#IndexAnnotationsShape defines release-index annotation constraints used by\nthe JSON Schema projection. The generator may omit constraints it cannot\nrepresent.",
            "additionalProperties": true,
            "properties": {
                "io.imgoci.name": {
                    "description": "io.imgoci.name is the stable product identifier shared by all releases of\nthat product.",
                    "$ref": "#/$defs/BasicTokenConstraint"
                },
                "org.opencontainers.image.version": {
                    "description": "org.opencontainers.image.version is the producer-assigned release version.\nIt is metadata; imgoci defines neither a tag mapping nor version order.",
                    "$ref": "#/$defs/ReleaseVersionConstraint"
                }
            },
            "required": [
                "io.imgoci.name",
                "org.opencontainers.image.version"
            ]
        },
        "ManifestSizeConstraint": {
            "description": "#ManifestSizeConstraint is a JSON integer from 1 through 9007199254740991.",
            "allOf": [
                {
                    "type": "number"
                },
                {
                    "type": "integer",
                    "maximum": 9007199254740991,
                    "minimum": 1
                }
            ]
        },
        "MediaTypeConstraint": {
            "type": "string",
            "description": "#MediaTypeConstraint is an RFC 6838 type and subtype using restricted names\nof no more than 127 ASCII characters each.",
            "pattern": "^[A-Za-z0-9][A-Za-z0-9!#$&^_.+-]{0,126}/[A-Za-z0-9][A-Za-z0-9!#$&^_.+-]{0,126}$"
        },
        "ReleaseArtifactTypeConstraint": {
            "type": "string",
            "description": "#ReleaseArtifactTypeConstraint identifies an imgoci v1 release without regard\nto ASCII letter case using a pattern that is portable to JSON Schema.",
            "pattern": "^[aA][pP][pP][lL][iI][cC][aA][tT][iI][oO][nN]/[vV][nN][dD]\\.[iI][mM][gG][oO][cC][iI]\\.[rR][eE][lL][eE][aA][sS][eE]\\.[vV]1$"
        },
        "ReleaseIndexMediaTypeConstraint": {
            "type": "string",
            "description": "#ReleaseIndexMediaTypeConstraint identifies an OCI image index without regard\nto ASCII letter case using a pattern that is portable to JSON Schema.",
            "pattern": "^[aA][pP][pP][lL][iI][cC][aA][tT][iI][oO][nN]/[vV][nN][dD]\\.[oO][cC][iI]\\.[iI][mM][aA][gG][eE]\\.[iI][nN][dD][eE][xX]\\.[vV]1\\+[jJ][sS][oO][nN]$"
        },
        "ReleaseIndexShape": {
            "type": "object",
            "description": "#ReleaseIndexShape defines the release-index object and local field\nconstraints used by the JSON Schema projection.",
            "additionalProperties": true,
            "properties": {
                "annotations": {
                    "description": "annotations labels the release index with its stable product identifier and\nproducer-assigned release version. It may contain other OCI annotations.",
                    "$ref": "#/$defs/IndexAnnotationsShape"
                },
                "artifactType": {
                    "description": "artifactType identifies the object as an imgoci v1 release index.",
                    "$ref": "#/$defs/ReleaseArtifactTypeConstraint"
                },
                "manifests": {
                    "type": "array",
                    "description": "manifests contains one file-entry descriptor for each transport\nalternative. It must contain at least one file-entry descriptor.",
                    "items": {
                        "$ref": "#/$defs/FileEntryDescriptorShape"
                    },
                    "minItems": 1
                },
                "mediaType": {
                    "description": "mediaType identifies the object as an OCI image index.",
                    "$ref": "#/$defs/ReleaseIndexMediaTypeConstraint"
                },
                "schemaVersion": {
                    "description": "schemaVersion identifies the OCI image-index schema version and must be 2.",
                    "const": 2
                }
            },
            "required": [
                "annotations",
                "artifactType",
                "manifests",
                "mediaType",
                "schemaVersion"
            ]
        },
        "ReleaseVersionConstraint": {
            "type": "string",
            "description": "#ReleaseVersionConstraint contains 1 to 128 printable ASCII characters and no\nwhitespace or control characters.",
            "maxLength": 128,
            "minLength": 1,
            "pattern": "^[!-~]+$"
        },
        "SHA256DigestConstraint": {
            "type": "string",
            "description": "#SHA256DigestConstraint is sha256: followed by 64 lowercase hexadecimal\ndigits.",
            "pattern": "^sha256:[0-9a-f]{64}$"
        },
        "UsageConstraint": {
            "type": "string",
            "description": "#UsageConstraint is one or more comma-separated basic tokens and no more\nthan 4096 ASCII bytes.",
            "maxLength": 4096,
            "minLength": 1,
            "pattern": "^[a-z0-9]+([._-][a-z0-9]+)*(,[a-z0-9]+([._-][a-z0-9]+)*)*$"
        }
    },
    "description": "#ReleaseIndexJSONSchema is the best-effort JSON Schema compatibility\nprojection. It preserves the required object shapes and local field constraints\nthat CUE can translate without weakening #ReleaseIndex.",
    "$ref": "#/$defs/ReleaseIndexShape"
}
