{"annotations":{"io.imgoci.name":"example","org.opencontainers.image.version":"1"},"artifactType":"application/vnd.imgoci.release.v1","manifests":[{"annotations":{"io.imgoci.architecture":"amd64","io.imgoci.compression":"none","io.imgoci.content.digest":"sha256:aaaaaaaaaaaaaaaaaaaaaaaaaaaaaaaaaaaaaaaaaaaaaaaaaaaaaaaaaaaaaaaa","io.imgoci.content.size":"1","io.imgoci.filename":"initramfs.img","io.imgoci.representation":"linux-netboot","io.imgoci.role":"initramfs","io.imgoci.target":"metal"},"artifactType":"application/vnd.imgoci.file.v1","digest":"sha256:1111111111111111111111111111111111111111111111111111111111111111","mediaType":"application/vnd.oci.image.manifest.v1+json","size":1},{"annotations":{"io.imgoci.architecture":"amd64","io.imgoci.compression":"none","io.imgoci.content.digest":"sha256:bbbbbbbbbbbbbbbbbbbbbbbbbbbbbbbbbbbbbbbbbbbbbbbbbbbbbbbbbbbbbbbb","io.imgoci.content.size":"1","io.imgoci.filename":"vmlinuz","io.imgoci.representation":"linux-netboot","io.imgoci.role":"kernel","io.imgoci.target":"metal"},"artifactType":"application/vnd.imgoci.file.v1","digest":"sha256:2222222222222222222222222222222222222222222222222222222222222222","mediaType":"application/vnd.oci.image.manifest.v1+json","size":1},{"annotations":{"io.imgoci.architecture":"amd64","io.imgoci.compression":"none","io.imgoci.content.digest":"sha256:cccccccccccccccccccccccccccccccccccccccccccccccccccccccccccccccc","io.imgoci.content.size":"1","io.imgoci.filename":"rootfs.img","io.imgoci.representation":"linux-netboot","io.imgoci.role":"rootfs","io.imgoci.target":"metal"},"artifactType":"application/vnd.imgoci.file.v1","digest":"sha256:3333333333333333333333333333333333333333333333333333333333333333","mediaType":"application/vnd.oci.image.manifest.v1+json","size":1}],"mediaType":"application/vnd.oci.image.index.v1+json","schemaVersion":2}
